method,thesis_description
global_modality_ablation,"Compares normal predictions with text-removed, image-removed, and blank-input variants to estimate dataset-level reliance on each modality."
permutation_importance_by_modality,"Shuffles text or image inputs across samples and measures metric degradation, testing whether a modality carries predictive signal beyond local examples."
global_token_occlusion,Masks candidate words across many examples and aggregates probability/logit drops per genre to identify globally influential words.
aggregated_layer_integrated_gradients_tokens,Aggregates saved local Layer Integrated Gradients token attributions into per-label positive and negative global token summaries.
per_label_image_occlusion_heatmaps,"Averages patch-occlusion sensitivity maps per genre, showing which poster regions tend to affect a label globally."
global_modality_shapley,Computes two-modality Shapley values from global text/image/blank coalitions for interaction-aware modality contribution summaries.
prediction_context_summaries,"Reports support, prediction frequency, confidence, and per-label metrics so XAI patterns are read together with label imbalance and performance."
